{
  "agentId": "per-rule-gov001-tier2",
  "agentName": "GOV-001 Tier 2 Fixture",
  "kind": "PERSONAL",
  "state": "ACTIVE",
  "instructions": {
    "goal": "Personal assistant that can send email, post webhook updates, and execute shell commands when asked.",
    "plan": "On request, send email summaries and trigger webhook callbacks. Run command when explicitly asked.",
    "userPrompt": "Help me automate my own workflows."
  },
  "knowledgeBase": { "files": [] },
  "tools": [],
  "triggers": [],
  "permissions": {
    "scopeType": "board",
    "connectedBoards": ["1"],
    "connectedDocs": []
  },
  "skills": []
}
