{
  "agentId": "per-rule-c005-pass",
  "agentName": "C-005 Pass Fixture",
  "kind": "PERSONAL",
  "state": "ACTIVE",
  "instructions": {
    "goal": "Track project deadlines and surface upcoming due dates from the connected board so the team can prioritize.",
    "plan": "Read upcoming items from the project board. Surface anything due within 7 days. Never fabricate a due date if the date column is empty.",
    "userPrompt": "You are a project deadline tracker. For every status update, cite the board item ID it came from and explain which date column drove the alert. Ask before changing any status. Default to dry-run mode if confirmation is not received. Never fabricate dates — if the source row is missing a date, surface it as 'date not in source data' instead of guessing."
  },
  "knowledgeBase": { "files": [] },
  "tools": [],
  "triggers": [],
  "permissions": {
    "scopeType": "board",
    "connectedBoards": ["1"],
    "connectedDocs": []
  },
  "skills": []
}
